"","agency_cd","site_no","station_nm","site_tp_cd","dec_lat_va","dec_long_va","colocated","queryTime","Latitude_Bin"
"231","USGS","15518000","NENANA R NR HEALY AK","ST",63.8448197,-148.9459267,FALSE,2019-11-01 16:56:00,7
"232","USGS","15272380","TWENTYMILE R BL GLACIER R NR PORTAGE AK","ST",60.8974833,-148.9241074,FALSE,2019-11-01 16:56:00,5
"233","USGS","15236900","WOLVERINE C NR LAWING AK","ST",60.36995858,-148.8987624,FALSE,2019-11-01 16:56:00,5
"234","USGS","635104148525900","HEALY C NR SUNTRANA AK","ST",63.8506541,-148.885372,FALSE,2019-11-01 16:56:00,7
"235","USGS","15518020","HEALY C AT SUNTRANA AK","ST",63.8523216,-148.8428722,FALSE,2019-11-01 16:56:00,7
"236","USGS","15272280","PORTAGE C AT PORTAGE LK OUTLET NR WHITTIER AK","ST",60.78471779,-148.8410319,FALSE,2019-11-01 16:56:00,5
"237","USGS","15908000","SAGAVANIRKTOK R NR PUMP STA 3 AK","ST",69.0158333,-148.8177778,FALSE,2019-11-01 16:56:00,9
"238","USGS","15516000","NENANA R NR WINDY AK","ST",63.457319,-148.8053397,FALSE,2019-11-01 16:56:00,7
"239","USGS","15910000","SAGAVANIRKTOK R NR SAGWON AK","ST",69.0896529,-148.7622664,FALSE,2019-11-01 16:56:00,9
"240","USGS","15515048","MARGUERITE C 3.6 MI AB EMMA C NR HEALY AK","ST",63.97388889,-148.761111,FALSE,2019-11-01 16:56:00,7
"241","USGS","15515060","MARGUERITE C AB EMMA C NR HEALY AK","ST",64.0084337,-148.7281673,FALSE,2019-11-01 16:56:00,7
"242","USGS","15515080","EMMA C NR HEALY AK","ST",64.01121149,-148.727612,FALSE,2019-11-01 16:56:00,7
"243","USGS","15237000","NELLIE JUAN R NR HUNTER AK","ST",60.4216016,-148.727082,FALSE,2019-11-01 16:56:00,5
"244","USGS","15236210","WHITTIER C AT WHITTIER AK","ST",60.7721972,-148.690673,FALSE,2019-11-01 16:56:00,5
"245","USGS","15519150","WF TOLOVANA R NR LIVENGOOD AK","ST",65.4662288,-148.6691702,FALSE,2019-11-01 16:56:00,8
"246","USGS","15519100","TOLOVANA R BL ROSEBUD C NR LIVENGOOD AK","ST",65.4648407,-148.6311143,FALSE,2019-11-01 16:56:00,8
"247","USGS","15896700","PUTULIGAYUK R NR DEADHORSE AK","ST",70.2672257,-148.6310988,FALSE,2019-11-01 16:56:00,10
"248","USGS","15291700","SUSITNA R AB TSUSENA C NR CHULITNA AK","ST",62.8233333,-148.6047222,FALSE,2019-11-01 16:56:00,6
"249","USGS","15519030","LIVENGOOD C AT LIVENGOOD AK","ST",65.5229722,-148.5463889,FALSE,2019-11-01 16:56:00,8
"250","USGS","15280900","GLACIER FORK KNIK R NR PALMER AK","ST",61.41905299,-148.445558,FALSE,2019-11-01 16:56:00,6
"251","USGS","15457790","GOLDSTREAM C BL ALABAM C NR LIVENGOOD AK","ST",65.574,-148.3878556,FALSE,2019-11-01 16:56:00,8
"252","USGS","15518900","TOLOVANA R NR LIVENGOOD AK","ST",65.47151429,-148.2688894,FALSE,2019-11-01 16:56:00,8
"253","USGS","15515800","SEATTLE C NR CANTWELL AK","ST",63.32510049,-148.2492169,FALSE,2019-11-01 16:56:00,6
"254","USGS","15236000","HOBO C NR WHITTIER AK","ST",60.96108947,-148.240688,FALSE,2019-11-01 16:56:00,5
"255","USGS","15514500","WOOD R NR FAIRBANKS AK","ST",64.4345581,-148.2151606,FALSE,2019-11-01 16:56:00,7
"256","USGS","15237020","MAIN BAY C NR PORT NELLIE JUAN AK","ST",60.5183108,-148.0942899,FALSE,2019-11-01 16:56:00,5
"257","USGS","15237360","SAN JUAN R NR SEWARD AK","ST",59.8173989,-147.885369,FALSE,2019-11-01 16:56:00,5
"258","USGS","15485500","TANANA R AT FAIRBANKS AK","ST",64.792344,-147.8413097,FALSE,2019-11-01 16:56:00,7
"259","USGS","15514000","CHENA R AT FAIRBANKS AK","ST",64.8454026,-147.703536,FALSE,2019-11-01 16:56:00,7
"260","USGS","15282000","CARIBOU C NR SUTTON AK","ST",61.8028244,-147.6847068,FALSE,2019-11-01 16:56:00,6
"261","USGS","15512800","CHENA R AT APPLE RD AT FAIRBANKS AK","ST",64.8409597,-147.6229793,FALSE,2019-11-01 16:56:00,7
"262","USGS","15535000","CARIBOU C NR CHATANIKA AK","ST",65.1495756,-147.553847,FALSE,2019-11-01 16:56:00,7
"263","USGS","15291500","SUSITNA R NR CANTWELL AK","ST",62.6981532,-147.5472168,FALSE,2019-11-01 16:56:00,6
"264","USGS","15291000","SUSITNA R NR DENALI AK","ST",63.10343837,-147.5180902,FALSE,2019-11-01 16:56:00,6
"265","USGS","15534900","POKER C NR CHATANIKA AK","ST",65.158467,-147.4827359,FALSE,2019-11-01 16:56:00,7
"266","USGS","15534800","CHATANIKA R AB POKER C NR CHATANIKA AK","ST",65.1409668,-147.4580118,FALSE,2019-11-01 16:56:00,7
"267","USGS","15512000","CHENA SL NR FAIRBANKS AK","ST",64.82040777,-147.43992,FALSE,2019-11-01 16:56:00,7
"268","USGS","15281500","CAMP C NR SHEEP MT LODGE AK","ST",61.83837366,-147.4108033,FALSE,2019-11-01 16:56:00,6
"269","USGS","15511000","L CHENA R NR FAIRBANKS AK","ST",64.88568988,-147.2496477,FALSE,2019-11-01 16:56:00,7
"270","USGS","15493700","CHENA R BL MOOSE C DAM AK","ST",64.8004119,-147.2301929,FALSE,2019-11-01 16:56:00,7
"271","USGS","644800147134000","CHENA R SITE 1 NR NORTH POLE AK","ST",64.79957858,-147.2301928,FALSE,2019-11-01 16:56:00,7
"272","USGS","644816147123500","CHENA R SITE 2 NR NORTH POLE AK","ST",64.80402348,-147.2121375,FALSE,2019-11-01 16:56:00,7
"273","USGS","644755147120000","CHENA R SITE 3 NR NORTH POLE AK","ST",64.7981903,-147.2024145,FALSE,2019-11-01 16:56:00,7
"274","USGS","15493500","CHENA R NR N POLE AK","ST",64.7959681,-147.201303,FALSE,2019-11-01 16:56:00,7
"275","USGS","644740147113000","CHENA R SITE 4 NR NORTH POLE AK","ST",64.7940238,-147.1940805,FALSE,2019-11-01 16:56:00,7
"276","USGS","15389500","CHANDALAR R NR VENETIE AK","ST",67.09656617,-147.1871195,FALSE,2019-11-01 16:56:00,8
"277","USGS","644710147101500","CHENA R SITE 5 NR NORTH POLE AK","ST",64.78569087,-147.1732459,FALSE,2019-11-01 16:56:00,7
"278","USGS","644735147094500","CHENA R SITE 6 NR NORTH POLE AK","ST",64.79263557,-147.1649133,FALSE,2019-11-01 16:56:00,7
"279","USGS","644835147075500","CHENA R SITE 7 NR NORTH POLE AK","ST",64.8093031,-147.1343592,FALSE,2019-11-01 16:56:00,7
"280","USGS","644855147071000","CHENA R SITE 8 NR NORTH POLE AK","ST",64.814859,-147.1218597,FALSE,2019-11-01 16:56:00,7
"281","USGS","15485200","GARRISON SL AT EIELSON AFB AK","ST",64.7037467,-147.1204583,FALSE,2019-11-01 16:56:00,7
"282","USGS","644925147065500","CHENA R SITE 9 NR NORTH POLE AK","ST",64.8231925,-147.1176939,FALSE,2019-11-01 16:56:00,7
"283","USGS","15485000","MOOSE C AT EIELSON AFB AK","ST",64.7134691,-147.1149038,FALSE,2019-11-01 16:56:00,7
"284","USGS","644935147045000","CHENA R BL MULLEN SL NR EIELSON AFB AK","ST",64.825971,-147.0829716,FALSE,2019-11-01 16:56:00,7
"285","USGS","644958147035000","CHENA R SITE 10 NR NORTH POLE AK","ST",64.8323603,-147.0663055,FALSE,2019-11-01 16:56:00,7
"286","USGS","645005147025500","CHENA R SITE 11 NR NORTH POLE AK","ST",64.83430508,-147.0510278,FALSE,2019-11-01 16:56:00,7
"287","USGS","644945147013500","CHENA R SITE 12 NR NORTH POLE AK","ST",64.8287499,-147.0288047,FALSE,2019-11-01 16:56:00,7
"288","USGS","15484000","SALCHA R NR SALCHAKET AK","ST",64.47152778,-146.9280556,FALSE,2019-11-01 16:56:00,7
"289","USGS","15493400","CHENA R BL HUNTS C NR TWO RIVERS AK","ST",64.8595879,-146.8057505,FALSE,2019-11-01 16:56:00,7
"290","USGS","15452300","BEAVER C NR MICHEL LK NR BEAVER AK","ST",66.2212817,-146.7647463,FALSE,2019-11-01 16:56:00,8
"291","USGS","642910146390000","SALCHA R 8MI AB GAGE NR SALCHAKET AK","ST",64.4856973,-146.6523757,FALSE,2019-11-01 16:56:00,7
"292","USGS","15452100","BEAVER C AB VICTORIA C NR BEAVER AK","ST",65.805163,-146.6511339,FALSE,2019-11-01 16:56:00,8
"293","USGS","15224000","DUCK R NR TIDEWATER NR VALDEZ AK","ST",60.9439062,-146.563121,FALSE,2019-11-01 16:56:00,5
"294","USGS","15291200","MACLAREN R NR PAXSON AK","ST",63.1190095,-146.5314208,FALSE,2019-11-01 16:56:00,6
"295","USGS","15223900","DUCK R AT SILVER LK OUTLET NR VALDEZ AK","ST",60.94918598,-146.5292316,FALSE,2019-11-01 16:56:00,5
"296","USGS","15532000","CHATANIKA R NR CHENA HOT SPRINGS AK","ST",65.2884898,-146.3899599,FALSE,2019-11-01 16:56:00,7
"297","USGS","15955000","CANNING R AB STAINES R NR DEADHORSE AK","ST",69.8817052,-146.3886988,FALSE,2019-11-01 16:56:00,10
"298","USGS","15493000","CHENA R NR TWO RIVERS AK","ST",64.9019722,-146.3613333,FALSE,2019-11-01 16:56:00,7
"299","USGS","15225945","ALLISON C AB MOUTH NR VALDEZ AK","ST",61.08114167,-146.3536839,FALSE,2019-11-01 16:56:00,5
"300","USGS","15225998","SOLOMON GULCH BYPASS NR VALDEZ AK","ST",61.0825319,-146.3059048,FALSE,2019-11-01 16:56:00,5
"301","USGS","15226000","SOLOMON GULCH NR VALDEZ AK","ST",61.0833653,-146.3056272,FALSE,2019-11-01 16:56:00,5
"302","USGS","15225997","SOLOMON GULCH AT TOP OF FALLS NR VALDEZ AK","ST",61.0786427,-146.3050704,FALSE,2019-11-01 16:56:00,5
"303","USGS","15225996","SOLOMON GULCH TAILRACE NR VALDEZ AK","ST",61.08308748,-146.3047938,FALSE,2019-11-01 16:56:00,5
"304","USGS","15219000","WF OLSEN BAY C NR CORDOVA AK","ST",60.7608659,-146.174225,FALSE,2019-11-01 16:56:00,5
"305","USGS","15227090","VALDEZ GLACIER R AT VALDEZ GLACIER LK NR VALDEZ AK","ST",61.14888889,-146.1715833,FALSE,2019-11-01 16:56:00,5
"306","USGS","15226620","LOWE R AB HORSETAIL FALLS NR VALDEZ AK","ST",61.0670833,-145.906111,FALSE,2019-11-01 16:56:00,5
"307","USGS","15226600","LOWE R IN KEYSTONE CANYON NR VALDEZ AK","ST",61.0894868,-145.8895257,FALSE,2019-11-01 16:56:00,5
"308","USGS","15226500","LOWE R NR VALDEZ AK","ST",61.0964322,-145.8609153,FALSE,2019-11-01 16:56:00,5
"309","USGS","15478000","TANANA R AT BIG DELTA AK","ST",64.1551574,-145.8523388,FALSE,2019-11-01 16:56:00,7
"310","USGS","15215990","NICOLET C NR CORDOVA AK","ST",60.5186253,-145.7917173,FALSE,2019-11-01 16:56:00,5
"311","USGS","15215992","HENEY C AT CANYON MOUTH NR CORDOVA AK","ST",60.52335006,-145.7633808,FALSE,2019-11-01 16:56:00,5
"312","USGS","15216008","MURCHISON C NR CORDOVA AK","ST",60.5364038,-145.716152,FALSE,2019-11-01 16:56:00,5
"313","USGS","15392000","BIRCH C AB TWELVEMILE C NR MILLER HOUSE AK","ST",65.3921157,-145.7149559,FALSE,2019-11-01 16:56:00,8
"314","USGS","15216100","HUMPBACK C NR CORDOVA AK","ST",60.6108405,-145.6786214,FALSE,2019-11-01 16:56:00,5
"315","USGS","15216003","MIDDLE ARM EYAK LK TR NR CORDOVA AK","ST",60.5575101,-145.6308655,FALSE,2019-11-01 16:56:00,5
"316","USGS","15216000","POWER C NR CORDOVA AK","ST",60.58667537,-145.620022,FALSE,2019-11-01 16:56:00,5
"317","USGS","15960000","TAMAYARIAK R NR KAKTOVIK AK","ST",69.8650563,-145.5955922,FALSE,2019-11-01 16:56:00,10
"318","USGS","15200280","GULKANA R AT SOURDOUGH AK","ST",62.5203918,-145.5330154,FALSE,2019-11-01 16:56:00,6
"319","USGS","15478040","PHELAN C NR PAXSON AK","ST",63.24027778,-145.4680556,FALSE,2019-11-01 16:56:00,6
"320","USGS","15477500","CLEARWATER C NR DELTA JCT AK","ST",64.05572009,-145.4401033,FALSE,2019-11-01 16:56:00,7
"321","USGS","15202000","TAZLINA R NR GLENNALLEN AK","ST",62.05508477,-145.4282607,FALSE,2019-11-01 16:56:00,6
"322","USGS","15215900","GLACIER R TRIB NR CORDOVA AK","ST",60.5327973,-145.3806148,FALSE,2019-11-01 16:56:00,5
"323","USGS","15200000","GAKONA R AT GAKONA AK","ST",62.30121279,-145.3077114,FALSE,2019-11-01 16:56:00,6
"324","USGS","15206000","KLUTINA R AT COPPER CENTER AK","ST",61.9523018,-145.3076939,FALSE,2019-11-01 16:56:00,6
"325","USGS","15208000","TONSINA R AT TONSINA AK","ST",61.66090357,-145.186003,FALSE,2019-11-01 16:56:00,6
"326","USGS","15208100","SQUIRREL C AT TONSINA AK","ST",61.66757058,-145.1760035,FALSE,2019-11-01 16:56:00,6
"327","USGS","15207800","L TONSINA R NR TONSINA AK","ST",61.47978829,-145.1534817,FALSE,2019-11-01 16:56:00,6
"328","USGS","15389100","PORCUPINE R 9.5MI AB MOUTH NR FORT YUKON AK","ST",66.6514678,-145.0991477,FALSE,2019-11-01 16:56:00,8
"329","USGS","15976000","NERUOKPUKKOONGA C NR BARTER ISLAND AK","ST",69.3080663,-145.0277593,FALSE,2019-11-01 16:56:00,10
"330","USGS","15975000","CHAMBERLIN C NR BARTER ISLAND AK","ST",69.29139878,-144.9666464,FALSE,2019-11-01 16:56:00,9
"331","USGS","15477790","CENTRAL C NR BIG DELTA AK","ST",64.3765652,-144.9454017,FALSE,2019-11-01 16:56:00,7
"332","USGS","15477740","GOODPASTER R NR BIG DELTA AK","ST",64.4501744,-144.9445717,FALSE,2019-11-01 16:56:00,7
"333","USGS","15439800","BOULDER C NR CENTRAL AK","ST",65.5676935,-144.8894025,FALSE,2019-11-01 16:56:00,8
"334","USGS","15477730","LIESE C NR BIG DELTA AK","ST",64.4476748,-144.8854024,FALSE,2019-11-01 16:56:00,7
"335","USGS","15477761","U WEST C NR BIG DELTA AK","ST",64.416565,-144.8509555,FALSE,2019-11-01 16:56:00,7
"336","USGS","15477770","SONORA C NR BIG DELTA AK","ST",64.37739989,-144.8137305,FALSE,2019-11-01 16:56:00,7
"337","USGS","15477768","SONORA C AB TRIB NR BIG DELTA AK","ST",64.3890668,-144.7801189,FALSE,2019-11-01 16:56:00,7
"338","USGS","15214000","COPPER R AT MILLION DOLLAR BRIDGE NR CORDOVA AK","ST",60.6711432,-144.7467135,FALSE,2019-11-01 16:56:00,5
"339","USGS","15199500","SINONA C NR CHISTOCHINA AK","ST",62.5906967,-144.6488398,FALSE,2019-11-01 16:56:00,6
"340","USGS","15476400","DRY C NR DOT LK AK","ST",63.6918472,-144.5733902,FALSE,2019-11-01 16:56:00,7
"341","USGS","15212000","COPPER R NR CHITINA AK","ST",61.46507857,-144.4579232,FALSE,2019-11-01 16:56:00,6
"342","USGS","15476300","BERRY C NR DOT LK AK","ST",63.689351,-144.3653325,FALSE,2019-11-01 16:56:00,7
"343","USGS","15195000","DICK C NR CORDOVA AK","ST",60.3416822,-144.3047573,FALSE,2019-11-01 16:56:00,5
"344","USGS","15980000","HULAHULA R NR KAKTOVIK AK","ST",69.7036856,-144.2010893,FALSE,2019-11-01 16:56:00,10
"345","USGS","15211500","TEBAY R NR CHITINA AK","ST",61.2314725,-144.1992858,FALSE,2019-11-01 16:56:00,5
"346","USGS","15476000","TANANA R NR TANACROSS AK","ST",63.3879716,-143.748634,FALSE,2019-11-01 16:56:00,7
"347","USGS","15389000","PORCUPINE R NR FORT YUKON AK","ST",66.9902637,-143.1404436,FALSE,2019-11-01 16:56:00,8
"348","USGS","15209700","WF KENNICOTT R AT MCCARTHY AK","ST",61.43372656,-142.9426256,FALSE,2019-11-01 16:56:00,6
"349","USGS","15209800","EF KENNICOTT R AT MCCARTHY AK","ST",61.43400459,-142.9323478,FALSE,2019-11-01 16:56:00,6
"350","USGS","15209750","BONANZA C NR MC CARTHY AK","ST",61.4937294,-142.8837439,FALSE,2019-11-01 16:56:00,6
"351","USGS","15474000","TOK R NR TOK JUNCTION AK","ST",63.3246533,-142.836952,FALSE,2019-11-01 16:56:00,6
"352","USGS","15472000","TANANA R NR TOK JUNCTION AK","ST",63.31632337,-142.643894,FALSE,2019-11-01 16:56:00,6
"353","USGS","15310000","MOSQUITO FORK BL KECHUMSTUK C NR CHICKEN AK","ST",64.0161111,-142.5447222,FALSE,2019-11-01 16:56:00,7
"354","USGS","15310002","MOSQUITO FORK 2 MI BL KECHUMSTUK C NR CHICKEN AK","ST",64.0344444,-142.5283333,FALSE,2019-11-01 16:56:00,7
"355","USGS","15388070","KANDIK R BL THREEMILE C NR NATION AK","ST",65.3852429,-142.4471206,FALSE,2019-11-01 16:56:00,8
"356","USGS","15388060","KANDIK R NR NATION AK","ST",65.3952435,-142.430455,FALSE,2019-11-01 16:56:00,8
"357","USGS","15331000","MF FORTYMILE R NR MOUTH NR CHICKEN AK","ST",64.4708611,-142.2215,FALSE,2019-11-01 16:56:00,7
"358","USGS","15330000","NF FORTYMILE R AB MF NR FRANKLIN AK","ST",64.4668333,-142.21625,FALSE,2019-11-01 16:56:00,7
"359","USGS","15470000","CHISANA R AT NORTHWAY JCT AK","ST",63.0060583,-141.8069194,FALSE,2019-11-01 16:56:00,6
"360","USGS","15388030","NATION R NR NATION AK","ST",65.23943139,-141.6551518,FALSE,2019-11-01 16:56:00,7
"361","USGS","15320100","WADE C TRIB NR CHICKEN AK","ST",64.1180119,-141.5558947,FALSE,2019-11-01 16:56:00,7
"362","USGS","15348000","FORTYMILE R NR STEELE CREEK AK","ST",64.3088552,-141.4045168,FALSE,2019-11-01 16:56:00,7
"363","USGS","15356000","YUKON R AT EAGLE AK","ST",64.789168,-141.2000892,FALSE,2019-11-01 16:56:00,7
"364","USGS","15129600","OPHIR C NR YAKUTAT AK","ST",59.52358729,-139.7452729,FALSE,2019-11-01 16:56:00,5
"365","USGS","15129500","SITUK R NR YAKUTAT AK","ST",59.58636636,-139.4941877,FALSE,2019-11-01 16:56:00,5
"366","USGS","15129510","OLD SITUK R NR YAKUTAT AK","ST",59.5702565,-139.4400197,FALSE,2019-11-01 16:56:00,5
"367","USGS","15129280","ITALIO R AB MOUTH NR YAKUTAT AK","ST",59.30202778,-139.0456944,FALSE,2019-11-01 16:56:00,4
"368","USGS","15129120","ALSEK R AT DRY BAY NR YAKUTAT AK","ST",59.1928056,-138.3339167,FALSE,2019-11-01 16:56:00,4
"369","USGS","15129000","ALSEK R NR YAKUTAT AK","ST",59.39471189,-138.083688,FALSE,2019-11-01 16:56:00,5
"370","USGS","15106100","BLACK R NR PELICAN AK","ST",57.704905,-136.0946057,FALSE,2019-11-01 16:56:00,4
"371","USGS","15056560","KLEHINI R NR KLUKWAN AK","ST",59.412726,-135.998797,FALSE,2019-11-01 16:56:00,5
"372","USGS","15056400","CHILKAT R AT GORGE NR KLUKWAN AK","ST",59.6274637,-135.9337827,FALSE,2019-11-01 16:56:00,5
"373","USGS","15056500","CHILKAT R NR KLUKWAN AK","ST",59.41494719,-135.9310198,FALSE,2019-11-01 16:56:00,5
"374","USGS","15101200","KALININ BAY TR NR SITKA AK","ST",57.3035248,-135.7781746,FALSE,2019-11-01 16:56:00,3
"375","USGS","15057596","SALMON R AT GUSTAVUS AK","ST",58.44465728,-135.7418302,FALSE,2019-11-01 16:56:00,4
"376","USGS","15056280","UPPER CHILKOOT LK OUTLET NR HAINES AK","ST",59.4238424,-135.6626638,FALSE,2019-11-01 16:56:00,5
"377","USGS","15057580","KAHTAHEENA R AB UPPER FALLS NR GUSTAVUS AK","ST",58.4432745,-135.6020974,FALSE,2019-11-01 16:56:00,4
"378","USGS","15057590","KAHTAHEENA R NR GUSTAVUS AK","ST",58.42299689,-135.5998738,FALSE,2019-11-01 16:56:00,4
"379","USGS","15056200","WEST C NR SKAGWAY AK","ST",59.5260629,-135.3546086,FALSE,2019-11-01 16:56:00,5
"380","USGS","15056210","TAIYA R NR SKAGWAY AK","ST",59.5116183,-135.3462752,FALSE,2019-11-01 16:56:00,5
"381","USGS","15056070","DAYEBAS C NR HAINES AK","ST",59.2971728,-135.333496,FALSE,2019-11-01 16:56:00,4
"382","USGS","15087618","STARRIGAVAN C AT UPPER BRIDGE NR SITKA AK","ST",57.12491678,-135.3334277,FALSE,2019-11-01 16:56:00,3
"383","USGS","15087610","NAKWASINA R NR SITKA AK","ST",57.2599243,-135.3334275,FALSE,2019-11-01 16:56:00,3
"384","USGS","15107910","WF INDIAN R NR TENAKEE AK","ST",57.8657679,-135.327059,FALSE,2019-11-01 16:56:00,4
"385","USGS","15087735","INDIAN R DIV RETURN FLOW FROM SJC AT SITKA AK","ST",57.0510267,-135.3214865,FALSE,2019-11-01 16:56:00,3
"386","USGS","15087730","INDIAN R DIV TO SJC AT SAWMILL C RD AT SITKA AK","ST",57.053249,-135.3195419,FALSE,2019-11-01 16:56:00,3
"387","USGS","15087700","INDIAN R AT SITKA AK","ST",57.05297119,-135.3162085,FALSE,2019-11-01 16:56:00,3
"388","USGS","15056100","SKAGWAY R AT SKAGWAY AK","ST",59.4658333,-135.3041667,FALSE,2019-11-01 16:56:00,5
"389","USGS","15087690","INDIAN R NR SITKA AK","ST",57.06658247,-135.2967628,FALSE,2019-11-01 16:56:00,3
"390","USGS","15107920","INDIAN R NR TENAKEE AK","ST",57.83021318,-135.268446,FALSE,2019-11-01 16:56:00,4
"391","USGS","15088000","SAWMILL C NR SITKA AK","ST",57.0510267,-135.2295402,FALSE,2019-11-01 16:56:00,3
"392","USGS","15106980","TONALITE C NR TENAKEE AK","ST",57.6779902,-135.2231705,FALSE,2019-11-01 16:56:00,4
"393","USGS","15107000","KADASHAN R NR TENAKEE AK","ST",57.69493509,-135.2181689,FALSE,2019-11-01 16:56:00,4
"394","USGS","15106970","MIDDLE BASIN C NR TENAKEE AK","ST",57.69215748,-135.2034467,FALSE,2019-11-01 16:56:00,4
"395","USGS","15106920","KADASHAN R AB HOOK C NR TENAKEE AK","ST",57.662435,-135.1867819,FALSE,2019-11-01 16:56:00,4
"396","USGS","15056030","KAKUHAN C NR HAINES AK","ST",59.0049486,-135.185708,FALSE,2019-11-01 16:56:00,4
"397","USGS","15106960","HOOK C NR TENAKEE AK","ST",57.6724353,-135.1795588,FALSE,2019-11-01 16:56:00,4
"398","USGS","15056095","GOAT LK OUTLET NR SKAGWAY AK","ST",59.5266173,-135.1790528,FALSE,2019-11-01 16:56:00,5
"399","USGS","15088200","SILVER BAY TR AT BEAR COVE NR SITKA AK","ST",57.01880376,-135.1642635,FALSE,2019-11-01 16:56:00,3
"400","USGS","15106940","HOOK C AB TR NR TENAKEE AK","ST",57.6771584,-135.130113,FALSE,2019-11-01 16:56:00,4
"401","USGS","15090000","GREEN LK NR SITKA AK","ST",56.9868572,-135.1120413,FALSE,2019-11-01 16:56:00,3
"402","USGS","15108000","PAVLOF R NR TENAKEE AK","ST",57.8413277,-135.0376135,FALSE,2019-11-01 16:56:00,4
"403","USGS","15092000","MAKSOUTOF R NR PORT ALEXANDER AK","ST",56.506575,-134.96975,FALSE,2019-11-01 16:56:00,3
"404","USGS","15100510","STEPHENS C NR ANGOON AK","ST",57.35688267,-134.9475948,FALSE,2019-11-01 16:56:00,4
"405","USGS","15100500","NICHOLS C NR ANGOON AK","ST",57.3538272,-134.9425946,FALSE,2019-11-01 16:56:00,3
"406","USGS","15054600","BRIDGET COVE TR NR AUKE BAY AK","ST",58.6202339,-134.93735,FALSE,2019-11-01 16:56:00,4
"407","USGS","15099900","TAKATZ C AT TAKATZ LAKE OUTLET NR BARANOF AK","ST",57.1310482,-134.8875862,FALSE,2019-11-01 16:56:00,3
"408","USGS","15054990","DAVIES C NR AUKE BAY AK","ST",58.6513446,-134.8870692,FALSE,2019-11-01 16:56:00,4
"409","USGS","15100000","TAKATZ C NR BARANOF AK","ST",57.1427162,-134.8656418,FALSE,2019-11-01 16:56:00,3
"410","USGS","15098000","BARANOF R AT BARANOF AK","ST",57.08715856,-134.8434192,FALSE,2019-11-01 16:56:00,3
"411","USGS","15054200","HERBERT R NR AUKE BAY AK","ST",58.52356128,-134.7962379,FALSE,2019-11-01 16:56:00,4
"412","USGS","15101500","GREENS C NR JUNEAU AK","ST",58.08799687,-134.7487297,FALSE,2019-11-01 16:56:00,4
"413","USGS","15093600","EB LOVERS COVE C DIVERSION NR BIG PORT WALTER AK","ST",56.3921273,-134.7148299,FALSE,2019-11-01 16:56:00,3
"414","USGS","15055500","ANTLER R BL ANTLER LK NR AUKE BAY AK","ST",58.85162387,-134.710401,FALSE,2019-11-01 16:56:00,4
"415","USGS","15093200","BETTY LK OUTLET NR PORT ARMSTRONG AK","ST",56.2982345,-134.682327,FALSE,2019-11-01 16:56:00,3
"416","USGS","15094000","DEER LK OUTLET NR PORT ALEXANDER AK","ST",56.51907976,-134.671208,FALSE,2019-11-01 16:56:00,3
"417","USGS","15109048","PETERSON C BL NF NR AUKE BAY AK","ST",58.2830018,-134.6667836,FALSE,2019-11-01 16:56:00,4
"418","USGS","15093400","SASHIN C NR BIG PORT WALTER AK","ST",56.3751833,-134.6628775,FALSE,2019-11-01 16:56:00,3
"419","USGS","15054000","AUKE C AT AUKE BAY AK","ST",58.3818946,-134.6378955,FALSE,2019-11-01 16:56:00,4
"420","USGS","15101490","GREENS C AT GREENS CREEK MINE NR JUNEAU AK","ST",58.08299837,-134.6334448,FALSE,2019-11-01 16:56:00,4
"421","USGS","15053800","LAKE C AT AUKE BAY AK","ST",58.39411726,-134.6323398,FALSE,2019-11-01 16:56:00,4
"422","USGS","15052800","MONTANA C NR AUKE BAY AK","ST",58.397729,-134.6112276,FALSE,2019-11-01 16:56:00,4
"423","USGS","15109000","FISH C NR AUKE BAY AK","ST",58.33022717,-134.5906698,FALSE,2019-11-01 16:56:00,4
"424","USGS","15053200","DUCK C BL NANCY ST NR AUKE BAY AK","ST",58.3749514,-134.579003,FALSE,2019-11-01 16:56:00,4
"425","USGS","15052475","JORDAN C BL EGAN DR NR AUKE BAY AK","ST",58.3660622,-134.5778918,FALSE,2019-11-01 16:56:00,4
"426","USGS","15052500","MENDENHALL R NR AUKE BAY AK","ST",58.4293972,-134.5745592,FALSE,2019-11-01 16:56:00,4
"427","USGS","15052495","NUGGET C AB DIV NR AUKE BAY AK","ST",58.4232871,-134.5253896,FALSE,2019-11-01 16:56:00,4
"428","USGS","15108600","HILDA C NR DOUGLAS AK","ST",58.22689146,-134.4989966,FALSE,2019-11-01 16:56:00,4
"429","USGS","15052009","LEMON C NR MOUTH NR JUNEAU AK","ST",58.3655085,-134.4798306,FALSE,2019-11-01 16:56:00,4
"430","USGS","15051010","SALMON C NR JUNEAU AK","ST",58.33217378,-134.4676074,FALSE,2019-11-01 16:56:00,4
"431","USGS","15102200","FAVORITE C NR ANGOON AK","ST",57.44744387,-134.4614756,FALSE,2019-11-01 16:56:00,4
"432","USGS","15051008","SALMON C AB CANYON MOUTH NR JUNEAU AK","ST",58.3327294,-134.4578847,FALSE,2019-11-01 16:56:00,4
"433","USGS","15052000","LEMON C NR JUNEAU AK","ST",58.3913429,-134.4226062,FALSE,2019-11-01 16:56:00,4
"434","USGS","15108800","LAWSON C AT DOUGLAS AK","ST",58.28439416,-134.4128813,FALSE,2019-11-01 16:56:00,4
"435","USGS","15050000","GOLD C AT JUNEAU AK","ST",58.30661738,-134.403159,FALSE,2019-11-01 16:56:00,4
"436","USGS","15049900","GOLD C NR JUNEAU AK","ST",58.3068952,-134.388436,FALSE,2019-11-01 16:56:00,4
"437","USGS","15048000","SHEEP C NR JUNEAU AK","ST",58.2746725,-134.3156547,FALSE,2019-11-01 16:56:00,4
"438","USGS","15102000","HASSELBORG C NR ANGOON AK","ST",57.660774,-134.2503567,FALSE,2019-11-01 16:56:00,4
"439","USGS","15046000","GRINDSTONE C NR JUNEAU AK","ST",58.20828306,-134.1778682,FALSE,2019-11-01 16:56:00,4
"440","USGS","15044000","CARLSON C NR JUNEAU AK","ST",58.316342,-134.1725938,FALSE,2019-11-01 16:56:00,4
"441","USGS","15040000","DOROTHY C NR JUNEAU AK","ST",58.227453,-134.0420256,FALSE,2019-11-01 16:56:00,4
"442","USGS","15039900","DOROTHY LK OUTLET NR JUNEAU AK","ST",58.24856608,-133.9834106,FALSE,2019-11-01 16:56:00,4
"443","USGS","15087565","GUNNUK C NR KAKE AK","ST",56.97902778,-133.9300278,FALSE,2019-11-01 16:56:00,3
"444","USGS","15031000","LONG R AB LONG LK NR JUNEAU AK","ST",58.18189797,-133.8867403,FALSE,2019-11-01 16:56:00,4
"445","USGS","15038000","CRATER C NR JUNEAU AK","ST",58.1371738,-133.7725699,FALSE,2019-11-01 16:56:00,4
"446","USGS","15087590","ROCKY PASS C NR POINT BAKER AK","ST",56.61909149,-133.737881,FALSE,2019-11-01 16:56:00,3
"447","USGS","15032000","LONG LK OUTLET NR JUNEAU AK","ST",58.16634167,-133.7267354,FALSE,2019-11-01 16:56:00,4
"448","USGS","15041200","TAKU R NR JUNEAU AK","ST",58.53829828,-133.7017432,FALSE,2019-11-01 16:56:00,4
"449","USGS","15034000","LONG R NR JUNEAU AK","ST",58.16634177,-133.6989569,FALSE,2019-11-01 16:56:00,4
"450","USGS","15030000","SWEETHEART FALLS C NR JUNEAU AK","ST",57.9427223,-133.683677,FALSE,2019-11-01 16:56:00,4
"451","USGS","15087570","HAMILTON C NR KAKE AK","ST",56.87216067,-133.6767336,FALSE,2019-11-01 16:56:00,3
"452","USGS","15036000","SPEEL R NR JUNEAU AK","ST",58.20245459,-133.6128437,FALSE,2019-11-01 16:56:00,4
"453","USGS","15081510","BONNIE C NR KLAWOCK AK","ST",55.7454732,-133.2467339,FALSE,2019-11-01 16:56:00,3
"454","USGS","15086600","BIG C NR POINT BAKER AK","ST",56.1313112,-133.1506053,FALSE,2019-11-01 16:56:00,3
"455","USGS","15086500","NECK C NR POINT BAKER AK","ST",56.09825466,-133.1406038,FALSE,2019-11-01 16:56:00,3
"456","USGS","15081500","STANEY C NR CRAIG AK","ST",55.81547447,-133.1344928,FALSE,2019-11-01 16:56:00,3
"457","USGS","15028300","FARRAGUT R NR PETERSBURG AK","ST",57.17299398,-133.111721,FALSE,2019-11-01 16:56:00,3
"458","USGS","15081497","STANEY C NR KLAWOCK AK","ST",55.8010287,-133.1103222,FALSE,2019-11-01 16:56:00,3
"459","USGS","15081614","HALFMILE C AB DIVERSION NR KLAWOCK AK","ST",55.55687287,-133.0186197,FALSE,2019-11-01 16:56:00,3
"460","USGS","15081495","NF STANEY C NR KLAWOCK AK","ST",55.7324084,-132.9688959,FALSE,2019-11-01 16:56:00,3
